id	title	around	metropolis	when	square	metropolisSquare	population	metropolisPopulation	desc	pic
SIR	Сирийский Курдистан (Западный Курдистан)	false	SY	2013	33300	185180	2500		Автономистское движение курдов началось в 1930-х гг. Сирийские власти вели дискриминационную политику в отношении курдов: было запрещено преподавание курдского языка и культуры, сотни тысяч курдов были лишены сирийского гражданства. Во время Арабской весны поддерживаемые Турцией курды оставались лояльны скорее действующей власти, чем оппозиции, опасаясь, что их положение станет ещё хуже	SyrianKurdistan.png
DNR	Донецкая Народная Республика	false	UA	2014	26517	603628	4343	42818	ДНР провозглашена в ходе конфликта на Украине и по итогам Донецкого общеобластного референдума, но по Конституции Украины входит в её состав	DNR.png
LNR	Луганская Народная Республика	false	UA	2014	26684	603628	2236	42818	ЛНР провозглашена в ходе конфликта на Украине и по итогам Луганского общеобластного референдума, но по Конституции Украины входит в её состав	LNR.png
KOS	Косово	false	RS	2008	10887	88407	1733	7243	Косово, в начале XX в. населённое албанцами, в результате Балканских войн вошло в состав Сербии, после чего сербы стали заселять регион, а албанцы — покидать его. В годы Второй мировой территория Косова была присоединена к Албании, и албанцы попытались изгнать оттуда сербов. В 1940-е гг. Косово стало частью Югославии как автономия в составе Сербской Республики, при этом переселение албанцев в Косово поощрялось властями и напряжённость между Сербией и Косово нарастала. ///В 1980-х албанцы в Косово начали требовать большей автономии, и росту протестных настроений немало способствовал президент Югославии Слободан Милошевич. В 1990 г. в регионе было введено чрезвычайное положение, затем началась война, провозглашена независимость Косово. В 1999 г. Сербия согласилась на ввод военного контингента НАТО в регион. Переговоры о статусе Косова ведутся до сих пор	Kosovo.png
PAL	Палестина	false	IL	1988	6020	20770	4394	8080	С 1922 г. территория Палестины находилась под мандатом Великобритании, которая активно способствовала переселению евреев в Палестину. К концу 1930-х, когда из нацистской Германии бежали полмиллиона евреев, арабы Палестины подняли восстание, которое вынудило Британию издать «Белую книгу» и ограничить квоту на евреев-иммигрантов. В 1947 г. Британия отказалась от мандата и на территории Палестины решением ООН было образовано государство Израиль с предоставлением особого статуса Иерусалиму. ///Семь арабских стран объявили войну Израилю с целью создать на его территории арабское государство, но последующие арабо-израильские войны не были для них успешными. Сегодня Палестина контролирует 16 провинций, является государством-наблюдателем при ООН, но получить независимость сможет лишь после признания Израиля	Palestina.png
AM	Армения	false		1991	29743	29743	3017	3017	Единственная страна, которая не признаёт суверенитет Армении, — Пакистан. Тем самым Пакистан выражает поддержку позиции Азербайджана в Нагорно-Карабахском вопросе. Кроме суверенитета Армении, Пакистан не признаёт и геноцид армян. Армения, в свою очередь, поддерживает Индию, а не Пакистан в Кашмирском конфликте	Armenia.png
IL	Израиль	false		1948	20770	20770	8080	8080	Проблема еврейского государства начала активно обсуждаться в 19 в., когда в Восточной Европе начались гонения на евреев. Миграции евреев из Восточной Европы в Западную спровоцировали подъём националистических движений по всей Европе, которые, в свою очередь, привели к возникновению сионизма. В 1897 г. была образована в Швейцарии была образована Всемирная сионистская организация, целью создания которой было возвращение евреев на историческую родину, в тогдашнюю Палестину. ///Спустя пару десятилетий мечта сионистов начала сбываться: в 1922 г. Лига Наций вручила Великобритании мандат на Палестину с целью образования «еврейского национального дома». Рост иммиграции евреев в населённую арабами Палестину привёл к социальной напряжённости и протестам. Великобритания пыталась построить единое государство для тех и для других, но её попытки не увенчались успехом, и в 1947 г. британское правительство отказалось от мандата. ///Вскоре ООН приняла план раздела Палестины, согласно которому регион должен был поделиться на арабское и еврейское государства. План был принят, но арабские лидеры принципиально отвергли создание еврейского государства, утверждая, что такой план несправедлив по отношению к палестинским арабам. Через день после образования государства Израиль на его территорию вторглись войска арабских стран, отказавшихся признавать раздел Палестины. ///Война арабов и евреев получила название Войны за независимость и привела к массовому исходу палестинских арабов из Израиля. Победа осталась за новообразованным государством, однако многие арабские страны до сих пор отказываются признавать суверенитет Израиля	Israel.png
CY	Кипр	false		1960	9250	9250	1142.6	1142.6	Турция не признаёт Кипр, так как поддерживает независимость Турецкой Республики Северного Кипра. При этом признание Кипра является одним из главных условий вступления Турции в Евросоюз	Cyprus.png
CN	КНР	false		1949	9596960	9596960	1366499	1366499	Китайская народная республика образовалась в 1949 г. после гражданской войны между Китайской Республикой и китайскими коммунистами. В 1971 г. Резолюцией №2758 права Китайской Республики в ООН (одной из стран-основательниц Организации) были переданы КНР. С этого времени и до сих пор Китайская Республика не прекращает попыток получить представительство в ООН, и некоторые страны поддерживают её в этом устремлении, отказываясь признавать КНР. В основном это дипломатические союзники Тайваня. ///В свою очередь, КНР занимает жёсткую позицию относительно невступления Китайской Республики в ООН и отделения её от материковой части Китая	China.png
KP	КНДР	false		1948	120540	120540	24720	24720	Изоляционистская политика КНДР установилась после Корейской войны 1950–1953 гг. С середины XX в. Северная Корея концентрировала свои дипломатические усилия в странах с сильными коммунистическими и социалистическими партиями, при этом с «западноориентированными» странами отношения установились напряжённые или не установились вообще. Официально Северную Корею не признают четыре страны, при этом более чем с тридцатью государствами мира у КНДР не установлены дипломатические отношения. Ещё с четырьмя (Аргентиной, Чили, Ираком и Ботсваной) были разорваны	KNDR.png
KR	Республика Корея	false		1948	99720	99720	48955.2	48955.2	Единственное государство, не признающее Южную Корею, — КНДР. Отношения между частями Корейского полуострова напряжены со времён Второй мировой. В последние десятилетия XX в. намечались шаги в сторону окончательного примирения регионов (с 1953 г. формально между Южной Кореей и КНДР действовало соглашение о перемирии, но не мирный договор), но в 2000–2010-х между Кореями начались вооружённые столкновения, КНДР начала ядерные испытания, Южная Корея — совместные с США военные учения. ///В 2014 г. соглашение было расторгнуто. КНДР претендует на единоличное управление Корейским полуостровом, и, соответственно, не признаёт суверенитет Южной Кореи	Korea.png
KAS	Азад Кашмир	false	PK	1947	11639	803940	3631.2	183209.6	Суверенитет Кашмира был провозглашён в знак протеста против правителя княжества Джамму и Кашмир Хари Сингха. О принадлежности штата, в котором преобладало мусульманское население, спорили Индия и Пакистан, что привело к войне. В результате 60% Кашмира перешло под контроль Индии, а 40% досталось Пакистану. Сегодня Кашмир признаётся Пакистаном самоуправляемым государством со своим президентом и правительством	Kashmir.png