id	title	around	metropolis	when	square	metropolisSquare	population	metropolisPopulation	desc	pic
TRNC	Турецкая Республика Северного Кипра	false	CY	1983	3355	9250	294.9	1142.6	Неравенство между греческой и турецкой общинами на территории Кипра было закреплено в Конституции 1960 г.: согласно ей, греки-киприоты получали 80% этнических квот, а турки-киприоты — 18%. Этнические чистки, начавшиеся в 1963 г., привели к тому, что ООН разместила в регионе миротворческий контингент. В 1974 г. на Кипре произошёл военный переворот, после чего туда вторглись турецкие войска. Кипр был разделён на южную и северную часть буферной зоной. ///Под контролем миротворцев греки-киприоты переселились на юг, а турки-киприоты — на север. Северная часть провозгласила независимость и стала именовать себя Турецким Федеративным государством Кипр, а через 8 лет — Турецкой Республикой Северного Кипра	TurkishCyprus.png
ABH	Абхазия	false	GE	1994	8665	69700	240	4490.5	В 1921 г. Республика Абхазия вошла в состав Грузинской ССР как союзное государство, но через десять лет утратила этот статус и стала обычной автономной республикой в составе Грузии. В 1990 был провозглашён суверенитет Абхазии, но Грузия настаивала на существовании договорных отношений с Абхазией. Разногласия привели к вооружённому грузино-абхазскому конфликту, который был улажен при посредничестве России и ООН. ///Абхазия провозгласила свою независимость Конституцией 1994 г., однако до грузино-российского кризиса 2008 г. никто из членов ООН суверенитет региона не признавал	Abhazia.png
SOS	Южная Осетия	false	GE	1991	3900	69700	72	4490.5	С 1922 по 1990 гг. Южная Осетия входила в состав Грузинской ССР как автономная область. Обострение межнациональных отношений (в регионе треть населения составляли грузины) пришлось на конец 1980-х, и этому сильно способствовала националистическая политика Звиада Гамсахурдиа. В 1991 г. Верховный совет Южной Осетии принял Декларацию о независимости, в 1992 г. 98% населения высказались на референдуме за независимость региона и его воссоединение с Россией. ///Но до 2008 г., когда произошёл вооружённый конфликт, независимость Южной Осетии признавали лишь непризнанные государства	SevOsetia.png
KHA	Халистан	false	IN	1986					Во времена британского колониального владения в штате Пенджаб правила династия сикхов. Сикхи составляли самую большую религиозную группу в регионе, хотя на территории Пенджаба жили также мусульмане и индуисты. В 1940 г. Всеиндийская мусульманская лига приняла резолюцию о размежевании индуистов с мусульманами: предлагалось отделить области, в которых жили мусульмане, и создать независимое мусульманское государство. Одной из этих областей был Пенджаб. ///У сикхов такие намерения вызвали серьёзное опасение: они могли остаться без своего государства, оставшись где-то между мусульманами и индуистами. В 1944 г. партия сикхов выдвинула требование создать на территории штата сикхское государство. После этого сикхи со всей Индии начали мигрировать в Пенджаб. В 70-х лидер сикхов начал собирать правительство, а в 1986 была провозглашена независимость Халистана. Сегодня влияние сикхов, как и их финансирование, сокращается	Halistan.png
CRT	Китайская Республика (о. Тайвань)	false	CRT	1911	35980	9596960	23299.7	1366499	Китайская Республика существует с 1911 г. и к началу своего основания контролировала материковую часть Китая и Монголию. После Второй мировой под её контроль перешли острова Тайвань и Пэнху. В результате гражданской войны правящая партия Гоминьдан потерпела поражение и перебазировалась на Тайвань, не перестав претендовать на управление и материковой частью Китая. Китайскую Республику признают два десятка стран, ещё несколько десятков поддерживают с ней дипломатические отношения через экономические и культурные представительства. ///Тайвань ежегодно подаёт заявку на вступление в ООН, но всегда получает отказ. В 2005 г. в КНР был принят закон о сохранении территориальной целостности Китая, что сделало шансы на общепризнанный суверенитет Китайской Республики ещё меньше. При этом Тайвань является полноправным членом ВТО, АТЭС и Всемирной Ассамблеи Здравоохранения	ChineseRepublic.png
SADR	Сахарская Арабская Демократическая Республика	false	MA	1976	266000	446550	267.4	32649	До 1975 г. регион был колонией Испании, затем, на волне деколонизации, Западная Сахара должна была получить независимость: правительство даже пообещало населению провести референдум. При этом на территорию исторически претендовали Марокко и Мавритания. Власти Алжира, давно соперничавшего с Марокко, поддерживали Фронт Полисарио — военно-политическую организацию, выступавшую против оккупации Мавританией и Марокко. Споры пыталась урегулировать ООН, признававшая за регионом право на самоопределение, но осенью 1975 г. на территорию Западной Сахары вторглись марокканские войска. ///В 1979 г. Марокко фактически аннексировала Западную Сахару. Спустя год Полисарио провозгласила независимость Западной Сахары. Переговоры о проведении нового референдума ведутся с 1992 г., но стороны никак не могут определиться с числом тех, кто имеет право голоса. САДР признают 48 государств мира, но ООН до сих пор отказывается признать её аннексию Марокко и принять в свой состав	SaharArabianDemokRep.png
MOR	Мальтийский Орден	false	IT	1099	0.012	301340	13	59570	Мальтийский орден — старейший рыцарский орден, который имеет дипломатические отношения со 104 государствами. Даже Италия признаёт его существование на своей территории, и сам орден имеет статус организации-наблюдателя при ООН	MaltOrden.png
PMR	Приднестровская Молдавская Республика	false	MD	1990	4163	33846	513.4	3557.6	С 1924 г. Приднестровье как Молдавская Автономная ССР входила в состав Украинской ССР. После присоединения Бессарабии в 1940 г. была создана Молдавская ССР. Приднестровская Молдавская Республика была провозглашена как советская республика в 1990 г., однако через несколько месяцев это решение было отменено Горбачёвым. В 1991 г. молдавский парламент принял закон «О декларации независимости», отменявший закон 1940 г., в соответствии с которым Приднестровье было частью Молдавской ССР. ///Однако сегодня ПМР продолжает быть под юрисдикцией Молдавии, так как ООН считает Молдавию продолжателем Молдавской ССР, частью которой являлось Приднестровье	Pridnesrovie.png
NKR	Нагорно-Карабахская Республика	false	AZ	1991	11500	86600	146.6	9511.1	До 1917 г. Карабах был населён преимущественно армянами, но после революции, когда азербайджанцы начали строить своё государство, в регионе начались столкновения между азербайджанцами и армянами. Спор был разрешён в пользу первых благодаря вмешательству турок и большевиков. В советское время доля азербайджанцев в Карабахе постепенно росла. Накануне распада СССР Нагорный Кабарах провозгласил независимость. ///В результате возникшего армяно-азербайджанского конфликта армяне были вытеснены с территории Шаумяновского района и Нагорного Карабаха, а азербайджанцы — с части прилегающих Нагорному Карабаху территорий. В 1994 г. была достигнута Договорённость о прекращении огня, и сегодня регион признаётся мировым сообществом как часть Азербайджана	NagonyKarabah.png
SML	Сомалиленд	false	SO	1991	137600	637657	3515.4	10251.6	В 1960 г. Сомалиленд получил независимость от Британии, затем образовал с бывшей колонией Итальянским Сомалилендом государство Сомали. Союз просуществовал до 1991 г., затем началась гражданская война, и Сомалиленд провозгласил свою независимость. По сравнению с другой частью Сомали, обстановка здесь достаточно мирная, а уровень жизни выше	Somalolend.png
PNT	Пунтленд	false	SO	1998	212510	637657	3900	10251.6	Пунтленд провозгласил свою независимость, чтобы стать автономным районом в составе Сомали в будущем, когда обстановка в регионе стабилизируется. Самопровозглашённое государство постоянно спорит с Сомалилендом по поводу территорий Санааг и Сул и считается одним из центров сомалийского пиратства	Puntlend.png
DJB	Джубаленд	false	SO	2011	87000	637657	1300	10251.6	Автономия Джубаленда (он же Азания) была провозглашена с целью очистить регион от группировки «Джамаат Аш-Шабааб». Государство поддерживается Кенией, которая видит в этом регионе буферную зону между своей территорией и Сомали, где идёт война кланов	Dzhumbalend.png
GLM	Галмудуг	false	SO	2006	46000	637657	1800	10251.6	Суверенитет Галмудуга был объявлен после того, как повстанцам из Союза исламских судов удалось уничтожить Альянс полевых командиров, которому принадлежала центральная часть Сомали. Как и некоторые другие самопровозглашённые государства в этом регионе, Галмудуг не теряет надежды стать автономным районом на территории будущего Сомалийского государства	Galmugur.png
HIH	Химан и Хеб	true	SO	2008	12750	637657		10251.6	Химан и Хеб — отклоловшийся район самопровозглашённого государства Галмудуг. В 2014 г. прошла серия дискуссий относительно воссоединения Галмудуга и Химана и Хеба в отдельное федеративное государство, но решение ещё не принято	HimaniIHeb.png
AVD	Авдаленд	false	SO	2010	21374	637657	417.3	10251.6	Сепаратистское движение Республики Авдаленд стремится к независимости с момента падения режима 3-го президента Сомали Мухаммеда Барре в 1995 г.	Avdalend.png
VAS	государство Ва	false	MM	1989	17000	678500	558	55167	Этническое меньшинство ва — древнейшие обитатели Индокитайского полуострова — политически отделилось от Коммунистической партии Мьянмы в 1980-х. В 1989 г. оно основало свою партию и провозгласило суверенитет	Va.png
SHA	государство Шан	false	MM	1996	155800	678500	4702	55167	Считается, что шаны зарабатывали на освободительную борьбу распространением наркотиков: нынешняя территория государства Шан раньше входила в состав «Золотого треугольника» — зоны, где в XX в. Существовала мощная система производства и торговли опиума. В 1996 г. у шанов сменился лидер, ряды их армии начали пополняться, но контролируемая территория стала сокращаться, а часть последователей даже заключила перемирие с руководством Мьянмы	Shan.png
ABY	Эмират Абьян	true	YE	2011	18250	527970		25408.3	В результате массовых акций протеста против режима Али Абдалла Салеха в 2011–2012 гг. в Йемене произошёл развал институтов власти. Южные районы страны перешли под контроль исламистов, которые провозгласили независимость эмирата Абьяна. Считается, что возрастание влияния исламистских группировок в стране выгодно самому Салеху: в руки исламистов перешли оружейные склады и некоторые населённые пункты, что позволяло бывшему президенту оправдывать применение вооружённых сил против оппозиции и просить дополнительных средств на борьбу с экстремизмом у Запада	Abian.png
VAZ	Вазиристан	false	PK	2006	11585	803209	791.1	183209.6	Противостояние между пуштунскими кланами и пакистанским правительством под эгидой борьбы с терроризмом в Северном Вазиристане идёт с начала 2000-х годов. Боевики, провозгласившие независимость исламского государства Вазиристан, утверждают, что на их стороне с пакистанской армией сражается местное население	Vaziristan.png
BAK	Демократическую Республику Бакасси	false	NG	2006	665	923768	300	140431.8	Бакасси — предмет давних территориальных споров между Нигерией и Камеруном. Вопрос о принадлежности Бакасси был вынесен на рассмотрение Международного суда ООН в 1994 г. В 2002 г. суд постановил, что регион должен остаться во владении Камеруна, несмотря на большую долю нигерийского населения. Нигерию это решение не устраивает до сих пор, а Бакасси и вовсе борется за независимость ни от кого	Bakassi.png
AZA	Азавад	false	ML	2012	822000	1240192	1295	15968.9	Азавад населён преимущественно туарегами, которые дважды за последние сорок лет устраивали неудачные восстания. Движение за независимость от Мали возникло после объединения нескольких групп туарегских боевиков. Независимость была провозглашена, когда боевики захватили Тимбукту, но спустя несколько месяцев туареги были вытеснены исламистами и фактически отказались от независимости, согласившись на автономию	Azavad.png
SUL	Султанат Сулу	true	MY	2010	147500	329758	1378.2	30073.4	История султаната Сулу насчитывает уже 5 веков. Регион пережил исламизацию, английское и испанские завоевания и государственный переворот. Окончательно покорённый испанцами в 1878 г. султанат сохранил автономию в вопросах внутреннего управления, однако она была упразднена в 1917 г. Борьба за независимость (в наши дни — от Малайзии) продолжается до сих пор	Sulu.png
NAG	Народная республика Нагалим	false	IN	1947	120000	3287263	3000	1220800	В 1947 г., после того как Индия получила независимость от Великобритании, племена нага отказались быть частью страны. Поначалу правительство Индии было не против и предоставило нага самим решать свою судьбу, но спустя два года передумало. Переговоры о статусе Нагалима ведутся последние полвека, периодически ситуация обостряется и стороны переходят к военным действиям	Nagalend.png
SIL	Силенд	false	GB	1967	0.00055	243809	0.05	63395.5	Виртуальное государство Силенд провозглашено отставным майором Бейтсом и существует на морской платформе в Северном море у берегов Великобритании. На платформе, сооружённой ещё во время Второй мировой войны, правит династия Бейтсов. В 1968 г. Британия пыталась занять платформу, но не сумела, против Бейтса был начат судебный процесс, но выяснилось, что платформа находится вне британских территориальных вод и, следовательно, вне юрисдикции королевства. В 2007 г. было объявлено о продаже платформы, но сделка так и не состоялась	Silend.png
MUR	Мурраварри	false	AU	2013	81000	7692024	4	23560.2	Территория Мурраварри — родина аборигенов, но за независимость сегодня борется некоренное население Австралии. В 2013 г. «мурраваррцы» провозгласили независимость, но ни Великобритания, ни Австралия её не признали	Murravari.png
EUA	Юалаи-Квинсленд	false	AU	2013		7692024			Представители Юалаи, потомки австралийских аборигенов, утверждают, что Великобритания и Австралия незаконно правят регионом на востоке Австралии, обращались даже с прошением к Елизавете II предоставить документы, согласно которым они являются подданными Её Величества. Эти документы никто для них не нашёл, но независимость республика Юалаи-Квинсленд так и не получила
BAN	Банксаморо	false	PH	2013	18150	299764			Мусульмане моро — коренное население Филиппин, сосредоточенное на втором по величине острове Минданао. Во времена испанской колонизации целью правительств было распространение католичества, филиппинцы-христиане начали переселяться на юг страны, и в результате моро превратились в малообеспеченную и малограмотную группу населения, при этом на острове расположены богатые месторождения нефти и газа	Baksamoro.png
